{
  "schema_version": "1",
  "host": "codex",
  "person_slug": "relationship-chen-yu",
  "variant": "advisor",
  "created_at": "2026-04-29T00:00:00+00:00",
  "files": [
    "SKILL.md"
  ],
  "install_hint": "Copy SKILL.md into your codex skills directory.",
  "review_passed": true,
  "privacy_check_passed": true
}